{
  "schema": "aipt.public.authority-validator-supersession/v1",
  "record_id": "UNREGISTERED-AIPT-P1-B000-AUTHORITY-VALIDATOR-SUPERSESSION-001",
  "chain_sequence": 1,
  "predecessor_record_id": null,
  "role": "AUTHORITY_VALIDATOR_IDENTITY",
  "path": "scripts/ci/validate/p1-b000-authority.mjs",
  "old_sha256": "f5ed47898ad13b193cd685ae9649c18cada3a6fb5893c1810867c91869ad8c7c",
  "new_sha256": "c6f0c8e01397200ce15f48bf1fc2412d9db477dddc37d3f99e0478d26956dd0c",
  "amendment_id": "UNREGISTERED-AIPT-P1-B000-AUTHORITY-AMENDMENT-001",
  "repair_task_id": "UNREGISTERED-AIPT-P1-B000-AUTHORITY-POSTMERGE-REPAIR-001",
  "repair_candidate_commit": "f9704100ad651b81758caf0aa20e63877b8a6d48",
  "reason": "Supersede the historical Candidate-only validator with a lifecycle-aware validator while preserving the immutable original identity and every Authority integrity gate.",
  "semantic_constraints": [
    "SUPPORT_CANDIDATE_MERGED_POST_MERGE_CLOSED_TOPOLOGY",
    "PRESERVE_ARTIFACT_HASH_VALIDATION",
    "PRESERVE_ANCESTRY_VALIDATION",
    "PRESERVE_CANDIDATE_IDENTITY_VALIDATION",
    "PRESERVE_SCOPE_VALIDATION",
    "PRESERVE_NEGATIVE_LIFECYCLE_CHECKS",
    "REJECT_UNAUTHORIZED_COMMITS",
    "REJECT_ARTIFACT_DRIFT",
    "REJECT_ILLEGAL_LIFECYCLE_TRANSITIONS"
  ],
  "regression_evidence": {
    "suite_identity": "84110c276d92d509419c163a889183216e659dda14f9e55f4c343e6674676da0",
    "result": "PASS",
    "commands": [
      "node scripts/ci/validate/p1-b000-authority.mjs",
      "node scripts/ci/validate/p1-b000-authority-repair.mjs",
      "node scripts/ci/validate/p1-b000-post-merge-reverification.mjs --target-sha 169f9bd006dabb88eb653ab09a33b0eef5eadaed --expected-tree 9cf551e7bc70d4354ca21d62a2bd456ed6f401bb"
    ],
    "negative_probe_count": 12,
    "b001_regression": "PASS"
  },
  "amendment_acceptance": {
    "accepted": true,
    "candidate_commit": "a1d614c7468f67d13bcbf32f65ade7613a85e202",
    "candidate_tree": "c03ce80729cce470e35325fd4d4a35e221221c55",
    "merge_commit": "33a53d53c6db474f46a886dcbbba6d083eee4f27",
    "merge_tree": "c03ce80729cce470e35325fd4d4a35e221221c55",
    "merge_parents": [
      "169f9bd006dabb88eb653ab09a33b0eef5eadaed",
      "a1d614c7468f67d13bcbf32f65ade7613a85e202"
    ],
    "owner_approved": true,
    "candidate_ci_run_id": 33040174063,
    "candidate_ci_conclusion": "success"
  },
  "repair_acceptance": {
    "state": "ACCEPTED",
    "independent_acceptance": "PASS",
    "candidate_ci_run_id": 33057642299,
    "candidate_ci_conclusion": "success"
  },
  "provenance": {
    "created_by_task": "UNREGISTERED-AIPT-P1-B000-AUTHORITY-POSTMERGE-REPAIR-001",
    "append_only": true,
    "original_identity_preserved": true
  }
}
